{"$schema":"https://json-schema.org/draft/2020-12/schema","$id":"https://spatial-policy.org/schema/place-package.schema.json","title":"SPP Place Package 0.1","type":"object","additionalProperties":false,"required":["place_package_version","place_id","policy_id","policy_version","scope","authority_id","requirements","metadata","algorithm","package_digest","signature"],"properties":{"place_package_version":{"const":"0.1"},"place_id":{"type":"string","minLength":1},"policy_id":{"type":"string","minLength":1},"policy_version":{"type":"integer","minimum":1},"scope":{"type":"array","minItems":1,"items":{"type":"string","minLength":1}},"authority_id":{"type":"string","minLength":1},"requirements":{"$ref":"place-requirement-set.schema.json"},"metadata":{"type":"object"},"algorithm":{"const":"Ed25519"},"package_digest":{"type":"string","pattern":"^sha256:[a-f0-9]{64}$"},"signature":{"type":"string","minLength":1}}}
