{"algorithm":"Ed25519","authority_id":"hospital-policy-authority","metadata":{"description":"Reference portable Place Package.","name":"Clinic Patient Wing"},"package_digest":"sha256:352d215ca708160633229a8cc64f357fdce122e496f5c084c6dcb60be64fcd89","place_id":"clinic/patient-wing","place_package_version":"0.1","policy_id":"urn:spp:clinic:patient-wing","policy_version":3,"requirements":{"admission_version":"0.1-experimental","environment_digest":"sha256:site-model-clinic-v1","place":"clinic","policy_version":3,"requirement_set_id":"urn:spp:clinic:patient-wing","requirements":[{"action":"data.video","degraded_restriction":"sensing.video.capture=disabled","essential":false,"id":"data.video_retention","operator":"=","requirement_version":"1.0","unit":"seconds","value":0},{"action":"movement.enter","essential":true,"id":"human_separation","operator":">=","requirement_version":"1.0","unit":"m","value":1.2},{"action":"movement.enter","essential":true,"id":"movement.max_speed","operator":"<=","requirement_version":"1.0","unit":"m/s","value":0.8},{"action":"sensing.video","essential":true,"id":"sensing.facial_recognition","operator":"prohibited","requirement_version":"1.0","value":true}],"space":"clinic/patient-wing","spp_version":"0.1"},"scope":["clinic/patient-wing"],"signature":"1tgdzXvOPxRqB3Y8i8FrlTKYQUgIQBrr5NHcSlhYz7O2k3uz9Xm0VlPZwptitXUM5Hy+CtEcOPop7QDRJCv1Aw=="}
